<xs:schema attributeFormDefault="unqualified" elementFormDefault="qualified" xmlns:xs="http://www.w3.org/2001/XMLSchema">
  <xs:element name="CarShowroom">
    <xs:annotation>
      <xs:documentation>Linking external DTD file to XML file</xs:documentation>
    </xs:annotation>
    <xs:complexType>
      <xs:sequence>
        <xs:element name="Showroom">
          <xs:complexType>
            <xs:sequence>
              <xs:element name="ShowroomName">
                <xs:annotation>
                  <xs:documentation>Creating child element for storing showroom details</xs:documentation>
                </xs:annotation>
                <xs:complexType>
                  <xs:simpleContent>
                    <xs:extension base="xs:string">
                      <xs:attribute type="xs:int" name="panNumber"/>
                    </xs:extension>
                  </xs:simpleContent>
                </xs:complexType>
              </xs:element>
              <xs:element name="Address">
                <xs:complexType>
                  <xs:simpleContent>
                    <xs:extension base="xs:string">
                      <xs:attribute type="xs:string" name="Country"/>
                    </xs:extension>
                  </xs:simpleContent>
                </xs:complexType>
              </xs:element>
              <xs:element type="xs:int" name="PhoneNumber"/>
              <xs:element type="xs:anyURI" name="Website"/>
              <xs:element type="xs:string" name="E-mail"/>
            </xs:sequence>
          </xs:complexType>
        </xs:element>
        <xs:element name="Cars">
          <xs:complexType>
            <xs:sequence>
              <xs:element name="Car" maxOccurs="unbounded" minOccurs="0">
                <xs:annotation>
                  <xs:documentation>Creating child element for storing car details</xs:documentation>
                </xs:annotation>
                <xs:complexType>
                  <xs:sequence>
                    <xs:element name="CarName">
                      <xs:complexType>
                        <xs:simpleContent>
                          <xs:extension base="xs:string">
                            <xs:attribute type="xs:string" name="Company" use="optional"/>
                          </xs:extension>
                        </xs:simpleContent>
                      </xs:complexType>
                    </xs:element>
                    <xs:element name="Price">
                      <xs:complexType>
                        <xs:simpleContent>
                          <xs:extension base="xs:string">
                            <xs:attribute type="xs:string" name="Currency" use="optional"/>
                          </xs:extension>
                        </xs:simpleContent>
                      </xs:complexType>
                    </xs:element>
                    <xs:element type="xs:string" name="EmissionType"/>
                    <xs:element name="EngineType">
                      <xs:complexType>
                        <xs:simpleContent>
                          <xs:extension base="xs:string">
                            <xs:attribute type="xs:string" name="MaxPower" use="optional"/>
                          </xs:extension>
                        </xs:simpleContent>
                      </xs:complexType>
                    </xs:element>
                    <xs:element name="EngineDisplacement">
                      <xs:complexType>
                        <xs:simpleContent>
                          <xs:extension base="xs:string">
                            <xs:attribute type="xs:string" name="MaxTorque" use="optional"/>
                          </xs:extension>
                        </xs:simpleContent>
                      </xs:complexType>
                    </xs:element>
                    <xs:element type="xs:string" name="Mileage"/>
                    <xs:element type="xs:string" name="BreakType"/>
                    <xs:element type="xs:string" name="BodyType"/>
                    <xs:element type="xs:string" name="GearBox"/>
                    <xs:element name="FuelCapacity">
                      <xs:complexType>
                        <xs:simpleContent>
                          <xs:extension base="xs:string">
                            <xs:attribute type="xs:string" name="FuelType" use="optional"/>
                          </xs:extension>
                        </xs:simpleContent>
                      </xs:complexType>
                    </xs:element>
                    <xs:element type="xs:string" name="GroundClearance"/>
                    <xs:element name="Dimension">
                      <xs:complexType>
                        <xs:simpleContent>
                          <xs:extension base="xs:string">
                            <xs:attribute type="xs:string" name="Weight" use="optional"/>
                          </xs:extension>
                        </xs:simpleContent>
                      </xs:complexType>
                    </xs:element>
                    <xs:element name="WheelSize">
                      <xs:complexType>
                        <xs:simpleContent>
                          <xs:extension base="xs:string">
                            <xs:attribute type="xs:string" name="WheelType" use="optional"/>
                          </xs:extension>
                        </xs:simpleContent>
                      </xs:complexType>
                    </xs:element>
                    <xs:element type="xs:string" name="Feautures"/>
                  </xs:sequence>
                  <xs:attribute type="xs:byte" name="carNumber" use="optional"/>
                </xs:complexType>
              </xs:element>
            </xs:sequence>
          </xs:complexType>
        </xs:element>
      </xs:sequence>
    </xs:complexType>
  </xs:element>
</xs:schema>